{
  "schema_version": "ObservationEvidence/v1",
  "observation_id": "obs_53ae093188334ffe",
  "producer": {
    "id": "comfy-quest-runtime",
    "kind": "runtime_observer"
  },
  "evidence_kind": "event_execution",
  "subject": {
    "quest_revision": "sha256:8d3673453dd65be7f529b3642350d27cf71c5dc376d55976903d313ed74c030e",
    "node_id": "enter_zone",
    "anchor_id": "hearth_zone"
  },
  "provenance": {
    "session_id": "sess_da95eba51ade",
    "observed_at": "2026-08-30T06:32:15.197822+00:00"
  },
  "quality": {
    "classification": "observed"
  },
  "correlation_spine": {
    "source_revision": "aaaaaaaaaaaaaaaaaaaaaaaaaaaaaaaaaaaaaaaa",
    "compiled_quest_revision": "sha256:8d3673453dd65be7f529b3642350d27cf71c5dc376d55976903d313ed74c030e",
    "install_request_id": "req_9856c46b6156436d",
    "active_runtime_revision": "sha256:8d3673453dd65be7f529b3642350d27cf71c5dc376d55976903d313ed74c030e",
    "anchor_id": "hearth_zone",
    "event_node_id": "enter_zone"
  }
}